ticker,current_price,market_cap,enterprise_value,ev_ebitda,pe_ratio,price_to_book,total_debt,debt_to_equity,free_cashflow,current_ratio,revenue_growth,profit_margins,roe,beta,news_text,imputed_count,net_debt,earnings_quality,value_score,health_score,growth_score
GRAPHITE.NS,541.4,105776357376.0,79089025024.0,68.257,43.873585,1.8120053999999999,2689999872.0,4.572,27762500.0,3.623,0.134,0.09333999500000001,0.040470000000000006,1.067,"Should Weakness in Graphite India Limited's (NSE:GRAPHITE) Stock Be Seen As A Sign That Market Will Correct The Share Price Given Decent Financials?. Stocks to Watch, December 10: Swiggy, IndiGo, Grasim, Graphite India, Anupam Rasayan, Zydus Life, Godrej Agrovet, IRB Infra, Meesho. Graphite India soars 8%, hits 4-year high on huge volume; HEG rallies 6%",0,2662237372.0,0.24000000000000002,0.4223404255319149,0.5395744680851065,0.38936170212765964
GRASIM.NS,2797.8,1898739662848.0,4288915177472.0,13.647,43.900833,1.9049851,2054033899520.0,126.634,-58601676800.0,0.915,0.189,0.026860000000000002,0.058280002000000004,0.218,"Grasim Inds Share Price Live Updates: Grasim Industries Breaks Above 20-Day EMA Threshold. Why Grasim Industries shares are in spotlight on Wednesday, December 10. Stocks to Watch today, Nov 6: Paytm, IndiGo, Delhivery, Grasim Industries",0,2112635576320.0,0.10400000000000001,0.6544680851063829,0.0923404255319149,0.3123404255319149
GRAVITA.NS,1772.8,129116774400.0,126966751232.0,27.461,35.07023,5.713678,4451200000.0,19.62,-3052999936.0,5.267,0.117,0.08818000000000001,0.22555000000000003,0.367,Gravita India share price surges 9% in a lacklustre market; should you buy this stock after Q2 results?. Gravita India - Positive Breakout: These 9 stocks cross above their 200 DMAs. Gravita India Technical Momentum Shifts Amid Mixed Market Signals,0,7504199936.0,0.589,0.4551063829787234,0.47425531914893615,0.5136170212765957
GESHIP.NS,1095.8,156444262400.0,86375022592.0,3.673,7.67367,1.0276871,12538800128.0,8.236,11202262016.0,7.598,-0.083,0.4166,0.14222999,0.671,"The Market Doesn't Like What It Sees From The Great Eastern Shipping Company Limited's (NSE:GESHIP) Earnings Yet. Market Trading Guide: GE Shipping, Signature Global are stocks to buy on Wednesday for up to 9% upside in short term. Top stocks to buy today: Stock recommendations for June 5, 2025",0,1336538112.0,0.6920000000000001,0.9674468085106382,0.544468085106383,0.4863829787234043
FLUOROCHEM.NS,3478.9,382157160448.0,403981828096.0,33.08,56.201935,5.012528,17219999744.0,22.475,-3554337536.0,1.662,0.019,0.1398,0.09854,-0.509,"Shares to buy in short term: Mehta Equities’ Riyank suggests Rubicon Research, JK Tyre, Stallion Fluorochem stock to buy. Stocks to Watch Today: Cohance Lifesciences, Indosolar, Biocon, Cochin Shipyard, Dixon Technologies,.... What triggered 11% jump in Stallion India share price today? Details here",0,20774337280.0,0.38599999999999995,0.32574468085106384,0.3068085106382979,0.34595744680851065
GUJGASLTD.NS,391.65,269948682240.0,264205271040.0,14.701,24.146116,3.0878944,1512499968.0,1.7389999999999999,-8605049856.0,1.052,-0.0,0.07018,0.13390000000000002,0.08700000000000001,Gujarat Gas Limited's (NSE:GUJGASLTD) Prospects Need A Boost To Lift Shares. Gujarat Gas (NSE:GUJGASLTD) shareholders have earned a 7.3% CAGR over the last five years. Just Three Days Till Gujarat Gas Limited (NSE:GUJGASLTD) Will Be Trading Ex-Dividend,0,10117549824.0,0.35,0.7253191489361701,0.3948936170212766,0.24893617021276596
GMDCLTD.NS,494.1,157228728320.0,151639719936.0,23.126,15.660856,2.336601,2782400000.0,4.139,-6507724800.0,5.18,-0.11,0.357,0.15535000000000002,0.361,"Stock market highlights: GMDC Ltd, Piccadily Agro hit 52-week high today; check full list. GMDC shares surge 7%; what analysts are saying. Gujarat Mineral Development Corporation Limited (NSE:GMDCLTD) Shares Fly 28% But Investors Aren't Buying For Growth",0,9290124800.0,0.737,0.7470212765957447,0.566595744680851,0.49531914893617024
GSPL.NS,282.45,159771803648.0,153236045824.0,6.258,15.476713,1.3351264999999999,1397104000.0,0.876,12935806976.0,1.5030000000000001,0.004,0.061430000000000005,0.10007,0.441,Gujarat Gas shares rise over 1% ahead of shareholder meeting on merger plan. Board of Gujarat State Petronet approves investment in JV GSPL India Gasnet. Gujarat State Petronet Approves ₹43.57 Crore Investment in GSPL India Gasnet,0,-11538702976.0,0.236,0.9146808510638297,0.47446808510638305,0.19872340425531915
HEG.NS,533.25,103022780416.0,104320991232.0,22.362,39.94382,2.2046237,6444499968.0,13.812,1186625024.0,2.407,0.232,0.11036000400000001,0.05661000000000001,1.071,"HEG soars 9%, Graphite hits 52-week high. Is it good time to buy GE stocks?. HEG, Indian Oil among 6 stocks that flash bullish signals, indicating a possible uptrend. Electrode maker HEG's shares soar 10 percent on return to profit and capacity expansion, taking Graphite...",0,5257874944.0,0.28500000000000003,0.5787234042553191,0.44531914893617025,0.5008510638297873
HBLENGINE.NS,801.8,222254907392.0,219527004160.0,24.345,34.709957,11.205366,872400000.0,4.396,-90761624.0,3.065,1.347,0.23270000000000002,0.38127000000000005,0.28800000000000003,"Investors Appear Satisfied With HBL Engineering Limited's (NSE:HBLENGINE) Prospects As Shares Rocket 27%. SENSEX holds 400-point lead, NIFTY50 firm above 25,600; HBL Engineering, Nykaa, NALCO among buzzing stocks. HBL Engineering Share Price Today - HBL Engineering Stock Price Live NSE/BSE",0,963161624.0,0.871,0.4197872340425532,0.5280851063829788,0.8974468085106384
HCLTECH.NS,1672.4,4531042648064.0,4504775294976.0,1576.198,26.698595,6.2727695,762000000.0,9.495,2022499968.0,2.294,0.058,0.13889,0.24326000000000003,0.276,"HCL Tech Share Price Live Updates: HCL Tech's Strong Monthly Gains. Coforge, TCS, HCLTech, other IT stocks decline up to 4% despite Fed rate cut hopes: Here's why. HCLTech rises 4% as it expands Canada footprint with new Calgary office",0,-1260499968.0,0.6930000000000001,0.3961702127659575,0.468936170212766,0.5170212765957447
HDFCAMC.NS,2664.7,1141867413504.0,1116763586560.0,31.298,41.681526,14.737651,0.0,20.567,22696112128.0,1.421,0.062,0.6272,0.37780997,0.444,"Nuvama, HDFC AMC tank upto 9% today; why are capital market stocks falling?. HDFC AMC share price may show a 50% drop today; here's why - should you buy?. HDFC AMC 1:1 bonus issue: Stock nears record date. Do you own?",0,-22696112128.0,0.963,0.2740425531914894,0.2997872340425532,0.7242553191489361
HDFCLIFE.NS,775.2,1672742567936.0,1662798528512.0,74.007,88.19113,9.872267,23499999232.0,13.88,26229950464.0,1.145,-0.275,0.020620000000000003,0.11649000000000001,0.56,"HDFC Life Share Price Live Updates: HDFC Life's monthly returns reflect market stability. HDFC Life to Trent - Prashanth Tapse of Mehta Equities suggests stocks to buy in the short term. Trade Spotlight: How should you trade HDFC Life, Tata Communications, Jubilant Ingrevia, Cummins India,...",0,-2729951232.0,0.196,0.09936170212765957,0.2978723404255319,0.07787234042553193
HFCL.NS,66.84,96390348800.0,109339115520.0,37.035,303.81818,2.3358378,17296199680.0,41.391,-8661262336.0,1.792,-0.046,0.0074699996,0.00759,0.334,"Stocks to Watch Today: Eternal, Biocon, ICICI Bank, HFCL, Ashoka Buildcon, MTAR Tech, Cochin Shipyard, Zen.... Stock Alert: HFCL, Ashoka Buildcon, InterGlobe Aviation, MTAR Technologies. HFCL, Premier Explosives stocks flash bullish signals, indicating possible uptrend",0,25957462016.0,0.044,,,
HAPPSTMNDS.NS,489.9,73669623808.0,67043454976.0,24.664,37.742683,4.528061,3636498547.2,20.567,1112062464.0,1.65,0.358,0.0888,0.12388,0.11800000000000001,Individual investors invested in Happiest Minds Technologies Limited (NSE:HAPPSTMNDS) copped the brunt of last week's ₹4.6b market cap decline. Happiest Minds Technologies' Q4 profit drops 53% to ₹34 crore; stock declines over 2%. India's Happiest Minds sees GenAI reaching double-digit revenue share in three years,0,2524436083.2,0.367,0.4986170212765957,0.32276595744680847,0.563404255319149
HAVELLS.NS,1402.4,879720660992.0,859488714752.0,41.708,60.059956,10.13661,2859800064.0,3.292,-7865950208.0,1.755,0.053,0.06751,0.17709999,0.316,Havells India Falls to 52-Week Low Amidst Sector-Wide Downtrend. Institutions own 28% of Havells India Limited (NSE:HAVELLS) shares but private equity firms control 41% of the company. Havells India Q2: Mixed show; brokerages cut targets but maintain 'Buy',0,10725750272.0,0.48000000000000004,0.19191489361702127,0.4704255319148936,0.35829787234042554
HEROMOTOCO.NS,5979.5,1196387991552.0,1090410446848.0,18.004,22.651337,5.696422,7180700160.0,3.395,33744762880.0,1.888,0.166,0.12526,0.26332,0.681,"Stocks to watch: Tata Motors, Oil India, Hero MotoCorp, SBI among 10 shares in focus today. Hero MotoCorp Limited's (NSE:HEROMOTOCO) Shares Lagging The Market But So Is The Business. Hero MotoCorp shares rise over 2% after BNP Paribas buys nearly 1% stake for ₹1,035 crore",0,-26564062720.0,0.69,0.6410638297872341,0.4870212765957447,0.6306382978723405
HEXT.NS,747.75,455384956928.0,432759930880.0,22.312,33.042423,7.230925,6288000000.0,10.008,7064750080.0,2.127,0.111,0.106529996,0.24176000000000003,,"Stock Market Holiday in November: NSE, BSE to remain shut next week for a day. Goldman Sachs says Reliance Industries, Titan Company and 12 other stocks to lead next market rally. Check. US Fed rate cut, India-US trade deal to Trump's likely visit to India: 5 triggers that may dominate Indian stock market",0,-776750080.0,0.636,0.49893617021276593,0.4551063829787234,0.5425531914893618
HSCL.NS,459.25,231700332544.0,231169343488.0,24.992,34.897415,5.5774837,8639899648.0,21.091,-2138151680.0,2.363,-0.058,0.14693,0.17351000000000003,0.091,"Stocks to Watch, May 23: BEML, Himadri Speciality Chemical, ITC, Sun Pharma, BEL, Trent, Nestle India, JSW Steel, and more. Volumes soar at Himadri Speciality Chemical Ltd counter. Himadri Specialty Chemicals (HSCL) - HUDCO among 5 stocks set to soar in 2025: Bajaj Broking",0,10778051328.0,0.633,0.47489361702127664,0.38659574468085106,0.4038297872340425
HINDALCO.NS,824.35,1842527338496.0,2348325011456.0,6.889,10.321146,1.3569434999999999,776500019200.0,57.571,-24482500608.0,1.475,0.135,0.07005,0.14206000000000002,0.871,"Hindalco Share Price Live Updates: Hindalco's Performance Snapshot. Metal stocks gain on Fed rate cut hopes, soaring silver prices: Hindustan Zinc, Vedanta, Hindalco jump up.... Stock Market Today: Sensex at 85,394.55, India VIX Jumps 4%; Hindalco, Tech Mahindra Among Top Gainers",0,800982519808.0,0.375,0.9314893617021276,0.21617021276595744,0.42382978723404263
HAL.NS,4320.8,2889642672128.0,2426890354688.0,29.915,34.107986,7.784902,114000000.0,0.031,-88891047936.0,2.194,0.109,0.26380000000000003,0.24792999000000002,0.439,"Beyond HAL & BEL: 3 ‘hidden’ defence stocks riding India’s aerospace boom. Defence Stocks: HAL, BEL and more — Motilal Oswal sees up to 37% upside in these shares. HAL shares fall up to 4.3%: PSU issues clarification on Dubai Air Show incident; here is what CLSA says",0,89005047936.0,0.8220000000000001,0.40404255319148935,0.5814893617021276,0.6970212765957448
HINDCOPPER.NS,357.05,345275891712.0,348408119296.0,37.842,60.619694,11.643947,1424099968.0,4.776,-402865888.0,1.373,0.382,0.24768,0.21079999,1.754,"Metal stocks rise for second day; Hind Copper, NALCO rise up to 3%: Here are four reasons behind rally. Top stocks in news: Maruti Suzuki, Canara Bank, IRFC, India Cements, Hind Copper, MOFSL. Nifty Metal hits record, ends 3-day fall; Tata Steel, Hind Copper in focus",0,1826965856.0,0.787,0.18361702127659574,0.39574468085106385,0.8353191489361702
HINDPETRO.NS,448.05,953370804224.0,1545301917696.0,5.75,6.8415026999999995,1.6756047,630947971072.0,110.909,115027902464.0,0.592,0.009000000000000001,0.03241,0.27104,1.044,"Q2 FY26 Results: L&T, Coal India, HPCL, SAIL, VBL Meet Today. Stocks to Watch, August 11: Tata Motors, Voltas, ICICI Bank, TVS Supply Chain, HPCL, BPCL, Bata India. India's HPCL reports surge in quarterly profit on strong refining margins",0,515920068608.0,0.498,0.9474468085106382,0.07787234042553193,0.28553191489361707
HINDUNILVR.NS,2305.6,5417325297664.0,5346630828032.0,37.644,49.84004,11.117595,17749999616.0,3.6109999999999998,111142502400.0,1.091,0.02,0.16950001,0.21819000000000002,0.323,"Hindustan Unilever shares plunge 7% on demerger of ice cream business. Hindustan Unilever Share Price Sees 6% Drop As Stock Adjusts To Kwality Walls Demerger. HUL Demerger: FMCG giant announces record date for Kwality Wall's spin off — Check key details, shareholding ratio here",0,-93392502784.0,0.7230000000000001,0.23361702127659573,0.36829787234042555,0.5102127659574469
HINDZINC.NS,522.65,2208362921984.0,2206754930688.0,12.444,20.88929,16.121223,120770002944.0,88.173,59808751616.0,0.86,0.035,0.31819000000000003,0.9911300000000001,0.538,"Stocks making the biggest moves midday: Kotak Mahindra, Dixon Technologies, Hind Zinc, Tejas Networks and more. Waaree Energies, Hind Zinc among 12 stocks with fresh analyst interest for upto 48% upside. Top stock picks for today, Oct 1: Hind Zinc, Hero MotoCorp, Canara Bank",0,60961251328.0,0.9319999999999999,0.5972340425531915,0.10808510638297873,0.66
POWERINDIA.NS,19230.0,857126535168.0,800243449856.0,93.566,116.4537,18.702024,844800000.0,1.843,22333175808.0,1.7149999999999999,0.188,0.10517999500000001,0.23965000000000003,0.209,GE Power India Technical Momentum Shifts Amid Mixed Market Signals. GE Power India Limited Receives ₹41.57 Crore GST Demand Notice from Tax Authorities. Investors Appear Satisfied With Hitachi Energy India Limited's (NSE:POWERINDIA) Prospects As Shares Rocket 26%,0,-21488375808.0,0.627,0.03319148936170213,0.47468085106382985,0.6038297872340426
HOMEFIRST.NS,1188.3,123457970176.0,206036533248.0,24.664,25.665228,3.05864,96526196736.0,240.452,1386025792.0,377.14,0.353,0.49415000000000003,0.14366001,0.402,"Home First Finance Company India - Positive Breakout: These 11 stocks cross above their 200 DMAs. Home First Finance Company India allots 68,907 equity shares under ESOP. Home First Finance Company India Faces Bearish Momentum Amid Technical Shifts",0,95140170944.0,0.711,0.6328723404255319,0.33999999999999997,0.830212765957447
HONASA.NS,256.3,83392274432.0,79785902080.0,71.891,63.915207,6.5379314,1421340032.0,11.184,1035420032.0,1.924,0.165,0.06022999800000001,0.10981,0.609,"Stocks in news: Tata Steel, LG India, Honasa Consumer, SpiceJet, Hero MotoCorp. Honasa Consumer shares surge 9%; ICICI Securities sees 42% upside post Q2. Honasa Consumer shares surge over 9% after Q2 results; should investors buy, sell or hold?",0,385920000.0,0.259,0.19382978723404254,0.42744680851063827,0.38553191489361704
HONAUT.NS,33845.0,299241340928.0,267051237376.0,48.057,58.102005,7.144115,928000000.0,2.215,5813875200.0,3.685,0.123,0.11373000000000001,0.12968999,0.324,Honeywell Automation India Limited's (NSE:HONAUT) 3.5% loss last week hit both individual investors who own 75% as well as institutions. Should You Buy Honeywell Automation India Limited (NSE:HONAUT) For Its Upcoming Dividend?. Honeywell Automation India's quarterly profit rises on improved demand,0,-4885875200.0,0.429,0.21808510638297873,0.5774468085106383,0.4731914893617022
HUDCO.NS,212.53,425463808000.0,1672783593472.0,24.664,15.1915655,2.3562608,1272865095680.0,705.764,1386025792.0,328.389,0.022,0.64356005,0.15944000000000003,0.974,"Stocks to Watch, December 10: Tata Power, Swiggy, Zydus Life, Hudco, Nalco. Top stocks in news: Meesho, AEL, Aequs, Tata Power, HUDCO, Swiggy, Zydus Life, Vidya Wires. Stocks to buy: Rajesh Palviya of Axis Sec suggests BPCL, HUDCO, Graphite India shares today",0,1271479069888.0,0.7829999999999999,0.7258510638297871,0.30021276595744684,0.6080851063829789
HYUNDAI.NS,2342.3,1903215116288.0,1820826664960.0,19.956,33.29969,10.840167,8589369856.0,4.892,-7797967360.0,1.3719999999999999,0.012,0.083380006,0.36782002,,"Stock to buy for long-term: Maruti vs Hyundai — Which auto major should you bet on?. Hyundai Motor India Valuation Shifts Signal Changing Market Dynamics. From Anil Ambani group stocks, TCS to Hyundai Motor India, JSW Energy – Here are 9 stocks to watch",0,16387337216.0,0.653,0.47468085106382985,0.3922340425531915,0.40595744680851065
ICICIGI.NS,1939.7,965628854272.0,958058332160.0,24.945,34.687054,5.8051214,0.0,20.567,52699750400.0,0.291,0.126,0.10932000000000001,0.17802,0.527,"ICICI Lombard General Insurance's (NSE:ICICIGI) investors will be pleased with their favorable 59% return over the last three years. Q2 Results 14th October Highlights: BoM, Persistent Systems, ICICI Prudential & IREDA Q2 profit up, Aditya Birla Money profit declines, Tech Mahindra, ICICIGI to announce Q2 results, HCL Tech, Anand Rathi Wealth, Just Dial shares in focus. Q2 Results Highlights: Cyient DLM net profit surges 102%; ICICI Lombard total income up 12.5% YoY",0,-52699750400.0,0.5720000000000001,0.4672340425531915,0.20404255319148937,0.536595744680851
ICICIPRULI.NS,635.85,920003805184.0,925620961280.0,45.917,70.649994,7.234858,28832100352.0,22.675,-16258450432.0,1.984,-0.524,0.02261,0.10762000000000001,0.516,Market volatility observed. Sector performance mixed.,0,45090550784.0,0.17650000000000002,0.18170212765957447,0.3529787234042553,0.06021276595744681
IDBI.NS,95.15,1023091081216.0,1059475030016.0,24.664,11.012732,1.5036347,243008897024.0,20.567,1386025792.0,1.72,0.298,0.5189,0.15128000000000003,0.20400000000000001,India prepares to invite bids for $7.1bn IDBI Bank stake – report. Govt may seek bids for $7 billion IDBI Bank stake this month. IDBI Bank hits 52-week high; stock rallies 9% on heavy volumes,0,241622871232.0,0.755,0.7820212765957447,0.3371276595744681,0.8374468085106384
IDFCFIRSTB.NS,80.61,692788264960.0,1051062697984.0,24.664,44.04918,1.7206345,407921590272.0,20.567,1386025792.0,1.72,0.161,0.06607,0.03441,0.502,IDFC First Bank shares jump 20% so far in 2025; what you need to know. Investing in IDFC First Bank (NSE:IDFCFIRSTB) five years ago would have delivered you a 142% gain. India's IDFC First Bank jumps to 9-month high after Investec sets price target,0,406535564480.0,0.169,0.5556382978723404,0.3371276595744681,0.3548936170212766
IFCI.NS,48.15,129755250688.0,191049220096.0,24.664,33.67133,1.4653965,35073601536.0,22.625,1386025792.0,19.19,0.145,0.20403999,0.048839998,0.319,"What's behind the 74 per cent rally in IFCI stock in 13 trading sessions?. Top stocks to buy today: Stock recommendations for October 1, 2025 - check list. IFCI share price jumps 8% after spurt in volume. Do you own?",0,33687575744.0,0.41,0.6379787234042553,0.4648936170212766,0.5421276595744681
IIFL.NS,568.2,241543020544.0,784052191232.0,24.664,28.495487,1.8608034,586914725888.0,401.134,1386025792.0,245.209,0.198,0.14350000000000002,0.07253000000000001,0.396,"IIFL Finance, Vodafone Idea and 6 other stocks form bullish white marubozu pattern. Banks at 'inflection point': IIFL sees earnings rebound, bets on Axis, HDFC. Manappuram, Muthoot, and IIFL Finance shares rally up to 57% in six months; will the surge continue?",0,585528700096.0,0.361,0.666063829787234,0.3070212765957447,0.534468085106383
INOXINDIA.NS,1141.3,103588388864.0,102441902080.0,33.888,42.20784,10.572782,993833984.0,10.139,-253462256.0,1.674,0.169,0.17549999,0.28408,,Inox India’s Market Assessment Reflects Mixed Signals Amid Technical and Financial Trends. Inox India - Positive Breakout: These 11 stocks cross above their 200 DMAs. Inox India Technical Momentum Shifts Amid Mixed Market Signals,0,1247296240.0,0.78,0.28702127659574467,0.3942553191489362,0.7051063829787234
IRB.NS,41.78,252370665472.0,441082249216.0,15.941,3.8330276,1.2551824,208515825664.0,102.312,2889176320.0,1.345,-0.08700000000000001,0.9491700000000001,0.38373002,-0.016,"TVS Supply Investment Approved by Board | IRB Infra Announces November Toll Figures | Top Buzzing Stocks Today. IRB Infra shares climb 5% on reporting 16% jump in November's toll revenue. Stocks making biggest moves midday: Groww, TVS Supply, Meesho, Aequs and more",0,205626649344.0,0.974,0.8963829787234043,0.16106382978723405,0.6195744680851064
IRCON.NS,157.76,148375748608.0,137857400832.0,18.903,24.727272,2.3041755999999998,51375501312.0,79.151,-4125287424.0,1.635,-0.192,0.06137000000000001,0.09422000000000001,0.551,"IRCON INTERNATIONAL Share Price Today Up 6%. Why did Ircon International share price rise 3% on Wednesday, May 21?. IRCON share price: Railway PSU stock jumps over 4% despite weak Indian stock market; here's why",0,55500788736.0,0.221,0.723404255319149,0.21063829787234042,0.12851063829787235
ITCHOTELS.NS,191.36,398612201472.0,380320710656.0,29.739,53.904224,3.5961812,802300032.0,0.724,1386025792.0,3.109,0.079,0.19773000000000002,0.14603000000000002,,"Dixon, ITC Hotels 'Death Cross' alert: Stocks down upto 32% from 2025 highs. ITC Hotels Shares Slide Despite Macquarie’s Bullish Outlook On Hospitality Sector. ITC Hotels shares in focus as BAT offloads 9% stake through Rs 3,856 crore block deals",0,-583725760.0,0.611,0.39063829787234045,0.5940425531914894,0.5429787234042553
ITC.NS,402.9,5047839096832.0,4876048269312.0,18.588,24.978302,7.104943,3629700096.0,0.507,133943238656.0,3.043,-0.06,0.44597998,0.27811,-0.064,"Dixon, ITC Hotels 'Death Cross' alert: Stocks down upto 32% from 2025 highs. ITC Share Price Highlights: ITC Stock Price History. Stocks to buy for long term: From ITC, TCS to ICICI Bank— Rahul Ghose of Hedged.in recommends 10 shares; do you own any?",0,-130313538560.0,0.907,0.5923404255319149,0.5948936170212766,0.5868085106382979
ITI.NS,302.55,291455729664.0,300774162432.0,-533.431,38.395044,19.323626,13108899840.0,87.135,-75040752.0,0.859,-0.465,-0.054840002000000006,-0.10949001,-0.23,ITI share price: State-owned telecom stock jumps 7% despite weak trends in Indian stock market. ITI Ltd share price hit 10% upper circuit in trade ahead of releasing Q4. Why ITI Share Price is Rising,0,13183940592.0,0.017,,,
INDGN.NS,531.75,127694249984.0,115684655104.0,21.118,28.727715,4.4474087,1220000000.0,4.257,-2408624896.0,4.961,0.171,0.1466,0.17062001000000002,,"Sensex crashes 1,300 points in 3 days; why is the Indian stock market falling? Explained with 5 key factors. Dollar slides as US Federal Reserve cuts key rate, Indian stock markets looks for firm opening. Indian stocks extend losses as investors await clarity on US rate outlook",0,3628624896.0,0.627,0.6074468085106383,0.5651063829787234,0.6268085106382979
INDIACEM.NS,418.65,194607939584.0,143137898496.0,-55.579,402.5481,1.307705,13403700224.0,13.307,3911824640.0,1.046,0.083,0.0030399999,0.00415,0.032,India Cem. Cap. Sees Revision in Market Assessment Amid Challenging Financial Trends. India Cements shares rise 7% high as UltraTech opens Offer for Sale process. Investors Appear Satisfied With The India Cements Limited's (NSE:INDIACEM) Prospects,0,9491875584.0,0.039,,,
INDIAMART.NS,2238.8,134511869952.0,106850107392.0,20.616,25.045307,6.285445,283160000.0,1.325,4961690112.0,2.297,0.125,0.36526000000000003,0.26791000000000004,0.447,Volumes spurt at Indiamart Intermesh Ltd counter. Indiamart Intermesh - Positive Breakout: These 11 stocks cross above their 200 DMAs. Declining Stock and Solid Fundamentals: Is The Market Wrong About IndiaMART InterMESH Limited (NSE:INDIAMART)?,0,-4678530112.0,0.885,0.5895744680851064,0.554468085106383,0.7625531914893617
INDIANB.NS,782.65,1054763057152.0,1197862682624.0,24.664,9.352892,1.3713427999999999,422819594240.0,20.567,1386025792.0,1.72,0.1,0.34112000000000003,0.15754,0.431,"INDIANB Share Price Today - Indian Bank on NSE/BSE. IndiGo, DLF & Indian Bank shares: MOFSL's Arpit Beriwal flags caution. Indian Bank's (NSE:INDIANB) earnings growth rate lags the 60% CAGR delivered to shareholders",0,421433568448.0,0.734,0.7952127659574467,0.3371276595744681,0.657872340425532
IEX.NS,142.45,126680825856.0,109917069312.0,18.342,26.928165,10.129417,37354000.0,0.299,3396483584.0,2.473,0.092,0.66678,0.40870997000000003,0.315,"'Market coupling' poses threat to IEX, says Nuvama; assigns 'Reduce' tag. IEX share price jumps over 5% after this update in Market Coupling Case. IEX share price today: Indian Energy Exchange stock crashes 15%; CERC clears market coupling rollout",0,-3359129584.0,0.973,0.5380851063829788,0.5870212765957447,0.7672340425531916
INDHOTEL.NS,729.0,1037826129920.0,1039832711168.0,33.516,61.467117,8.968996,32259899392.0,25.013,5254624768.0,2.01,0.124,0.18123,0.15217,-0.363,"The Indian Hotels Company Limited's (NSE:INDHOTEL) Recent Stock Performance Looks Decent- Can Strong Fundamentals Be the Reason?. Indian Hotels Company Q2 results: Net profit slumps 49% YoY to ₹285 crore, EBITDA margin expands. Indian Hotels share price declines 4% post Q4 results. Should you buy or sell this Rakesh Jhunjhunwala portfolio stock?",0,27005274624.0,0.624,0.22893617021276597,0.35212765957446807,0.603404255319149
IOC.NS,161.75,2284110217216.0,3631816638464.0,6.678,8.961219,1.129547,1466805780480.0,72.631,190993776640.0,0.6960000000000001,0.021,0.03271,0.13166,0.807,"IOC News Today, Dec 11: Indian Oil’s Stock Activity Amid Market Fluctuations. Stocks in news: Jio Financial, Adani Green, Nestle, Cipla, IOC, Waaree Energies. 3M India, IOC, Titan, JK Tyre: Stocks at 52-week high; buy or sell?",0,1275812003840.0,0.261,0.9504255319148935,0.11127659574468085,0.20297872340425532
IOB.NS,37.0,712493826048.0,938802479104.0,24.664,16.29956,2.0932336,464331898880.0,20.567,1386025792.0,1.72,0.23900000000000002,0.31682000000000005,0.14130999,0.184,"Indian Overseas Bank - Negative Breakout: These 12 stocks cross below their 200 DMAs. Buy, sell, hold? Trading strategy in PSU bank stocks amid stake sale buzz?. Indian Overseas Bank Surges with 15.76 Million Shares Traded Today",0,462945873088.0,0.657,0.7275531914893617,0.3371276595744681,0.7493617021276597
