ticker,current_price,market_cap,enterprise_value,ev_ebitda,pe_ratio,price_to_book,total_debt,debt_to_equity,free_cashflow,current_ratio,revenue_growth,profit_margins,roe,beta,news_text,imputed_count,net_debt,earnings_quality,value_score,health_score,growth_score
OIL.NS,404.85,658532139008.0,960355434496.0,8.021,11.028331,1.1711122999999999,358541492224.0,58.174,-26049787904.0,1.557,0.158,0.17838,0.11196,0.302,"Indian stock market: 8 key things that changed for market overnight - Gift Nifty, US Fed rate cut to crude oil. India's crude oil loadings from Russia dip, but robust in December. Gulf Oil Lubricants India Faces Bearish Momentum Amid Technical Shifts",0,384591280128.0,0.488,0.9295744680851064,0.21808510638297873,0.5731914893617021
OLAELEC.NS,36.66,153821921280.0,153046007808.0,-8.228,38.395044,3.7150385,31210000384.0,71.879,-19888750592.0,1.726,-0.432,-0.7183400000000001,-0.41777000000000003,,Ola Electric shares surge 31% in five sessions; here is why the stock is soaring. Ola Electric Share Price: OLAELEC shares gain over 8% today - here's why. Ola Electric Stock Falls 1.69% Despite Company Issuing Clarification on Auditor’s Inventory Control Observation,0,51098750976.0,0.004,,,
OLECTRA.NS,1194.2,98033360896.0,99572391936.0,36.204,68.63218,8.729277,3662873088.0,32.542,-1375885952.0,1.599,0.254,0.072569996,0.13527,0.209,"Olectra Greentech clarifies on electric concept car; shares jump 5%. Olectra Greentech - India Cements among 5 stocks closed crossing above VWAP. Top Gainers & Losers on August 28: Adani Total Gas, Olectra Greentech, IndiGo, MCX among top losers today",0,5038759040.0,0.36,0.19680851063829785,0.27297872340425533,0.512340425531915
PAYTM.NS,1280.5,820261421056.0,679109984256.0,451.836,38.395044,5.3120213,1600000000.0,1.045,35287875584.0,2.477,0.242,-0.07822000000000001,-0.04086,-0.655,"Biggest Stock Losers Today in India (10 December 2025): Kaynes Tech, IndiGo, Eris Lifesciences, Paytm Drag NSE & BSE. Trade Spotlight: How should you trade ICICI Prudential Life, Hindustan Zinc, Nykaa, Paytm, Cummins India,.... Paytm stock down 2% after over 2% equity change hands in large deal on NSE",0,-33687875584.0,0.019,,,
ONESOURCE.NS,1653.6,189500833792.0,204157255680.0,41.699,465.80283,3.1917605,12947330048.0,21.928,1386025792.0,1.018,-0.314,0.026260000000000002,0.14603000000000002,,"Onesource Specialty Pharma - Negative Breakout: These 12 stocks cross below their 200 DMAs. OneSource Specialty Pharma allots 23,000 equity shares under ESOP. Onesource Specialty Pharma - Positive Breakout: These 10 stocks cross above their 200 DMAs",0,11561304256.0,0.299,0.2519148936170213,0.2246808510638298,0.11829787234042555
OFSS.NS,8005.0,696667013120.0,636097200128.0,20.812,29.482176,9.444848,340000000.0,0.461,19252625408.0,5.6129999999999995,0.069,0.33555,0.32889998,0.149,"Oracle Financial Services Software - Concurrent Losers: 9 stocks decline for 5 consecutive sessions. IT stocks soar: OFSS, Persistent and others gain up to 10% as US Fed rate-cut hopes rise. OFSS says Oracle Corp’s earnings have no direct impact on its business, stock gives up day's gains",0,-18912625408.0,0.904,0.5006382978723404,0.636595744680851,0.6914893617021277
POLICYBZR.NS,1948.1,898826895360.0,864423313408.0,408.653,194.81,13.2015505,3291500032.0,4.859,449400000.0,4.109,0.382,0.08012000000000001,0.07165,0.425,PB Fintech Limited (NSE:POLICYBZR) Not Lagging Industry On Growth Or Pricing. India's PB Fintech slips; Motilal Oswal initiates coverage with 'neutral'. PB Fintech shares fall over 5% after company says it will infuse ₹696 crore in arm PB Healthcare Services,0,2842100032.0,0.234,0.03851063829787234,0.5465957446808511,0.503404255319149
PCBL.NS,311.9,122738139136.0,166553845760.0,15.018,33.902172,3.0420067,52523900928.0,135.218,-995537472.0,0.872,0.0,0.041650000000000006,0.09061000000000001,0.34700000000000003,"Nagaraj Shetti suggests PCBL Chemical, BLS International shares to buy in the short term; do you own?. PCBL Chemical - HCL Technologies and 9 other stocks showing Bullish RSI upswing. PL Capital bets on these 3 chemical stks despite sector headwinds; details",0,53519438400.0,0.176,0.652127659574468,0.08382978723404255,0.1472340425531915
PGEL.NS,548.2,156040069120.0,165238554624.0,39.281,60.441017,5.7923545999999995,5904653824.0,20.346,-11389101056.0,2.061,-0.024,0.050530000000000005,0.12576,-0.4,"PG Electroplast share price crashes 15%, down 37% in four sessions. What’s behind the selloff?. PG Electroplast acquires 50-acre land in Andhra Pradesh; stock gains ~2%. PG Electroplast shares gain 1.5% on acquiring 50-acre land in Andhra Pradesh",0,17293754880.0,0.2825,0.2629787234042553,0.38893617021276594,0.18361702127659574
PIIND.NS,3376.0,512150110208.0,471125196800.0,23.726,33.844612,4.7304044,2422000128.0,2.237,-3626625024.0,4.052,-0.157,0.20273000000000002,0.14849,0.374,"Market Highlights: Sensex settles 336 pts higher, Nifty above 25,700; BEL, Adani Ports rise 2% each. Stock Alert: PI Industries, IOL Chemicals & Pharma, Awfis Space Sol, Zaggle Prepaid. Share Market Highlights 12 August 2025: Sensex ends at 80,235 after 833-point swing; Nifty at 24,487",0,6048625152.0,0.631,0.5472340425531914,0.5829787234042554,0.40680851063829787
PNBHOUSING.NS,900.15,234496786432.0,670380261376.0,24.664,10.9215,1.3040229,470663790592.0,261.907,1386025792.0,4.476,0.211,0.59555,0.127,0.035,"PNB Housing Finance shares tank 15%; here's why investors are dumping stock. Indian Oil, PNB Housing & more: Top stocks to buy on October 29—Check list. Explained: Why PNB Housing Finance Ltd shares crashed 18% today",0,469277764800.0,0.669,0.7898936170212766,0.2908510638297872,0.754468085106383
PTCIL.NS,18227.0,273269194752.0,277858385920.0,363.936,445.1038,19.289852,1792802048.0,12.655,-4354186240.0,4.924,0.722,0.15126,0.045,0.067,"PTC Ind, RIL among 5 Indian stocks in Goldman Sachs' APAC conviction list. PTC Industries shares jump 8% on bagging over ₹100 crore order; key details to know. Goldman Sachs initiates coverage on Data Patterns, PTC Industries and 6 other Indian defence stocks, sees",0,6146988288.0,0.352,0.02042553191489362,0.5042553191489362,0.6353191489361703
PVRINOX.NS,1055.2,103678427136.0,171871846400.0,17.261,38.395044,1.4562618,74662002688.0,105.057,9985500160.0,0.483,0.124,-0.00598,-0.005450000000000001,0.289,PVR Inox and 6 Other Stocks in Which Promoters Reduced Their Pledges by Up to 8.21% in Q2 FY26. PVR Inox Ltd drops for fifth straight session. PVR Inox share price gains 12% in August; should you buy more or book profit? Experts weigh in,0,64676502528.0,0.031,,,
PAGEIND.NS,37065.0,413439459328.0,406882615296.0,38.566,54.014862,29.33836,2681272064.0,19.029,6425676288.0,1.6219999999999999,0.036000000000000004,0.15228,0.5272,0.01,"Jockey India licensee Page Ind drops 8% in 2 days; Should you buy or sell?. Investors in Page Industries (NSE:PAGEIND) have seen stellar returns of 160% over the past five years. Dividend Stocks This Week: Page Ind, Ashoka Leyland, LTI Mindtree Among 9 Stocks To Trade Ex-Dividend",0,-3744404224.0,0.8029999999999999,0.16872340425531915,0.33617021276595743,0.5548936170212766
PATANJALI.NS,534.05,582468108288.0,585156722688.0,29.8,40.73608,4.7962246,28952231936.0,23.903,-18640445440.0,2.101,0.202,0.03807,0.12432000000000001,-0.241,Patanjali Foods shares in focus as stock turns ex-bonus for 2:1 issue on record date today. Patanjali Foods up 2% as board to consider bonus shares on July 17. Patanjali Foods share price gains over 3% as board to consider bonus share issue on THIS date,0,47592677376.0,0.25,0.4227659574468085,0.35925531914893616,0.3957446808510638
PERSISTENT.NS,6204.0,965962694656.0,925541335040.0,38.855,58.095325,13.502925,4039379968.0,5.651,18186725376.0,2.454,0.23600000000000002,0.12597,0.26198998,0.456,"Axis Securities offers Nifty playbook for the week, 3 stock picks for up to 13% upside. Persistent Systems bleeds over 9% post mixed Q1; here's what brokerages say. Stocks to buy for short term: ICICI Bank, Bajaj Finserv, Persistent among 6 shares experts recommend for next 1-2 weeks",0,-14147345408.0,0.6910000000000001,0.17297872340425532,0.5,0.6893617021276597
PETRONET.NS,271.1,406941728768.0,311756980224.0,6.6530000000000005,11.0879345,1.9256586,25046599680.0,11.871,24548112384.0,4.008,-0.155,0.07735,0.18330999,0.232,"Stock Alert: Mazagon Dock, Tata Steel, LIC, Petronet LNG. Petronet LNG Secures ₹12,000 Crore Loan for Dahej PDH PP Project. Stocks to Watch, Dec 11: TCS, Meesho, Cipla, Adani Enterprises, Adani Green, IT stocks, Petronet LNG, Tata Steel, Lloyds Metals, HUL",0,498487296.0,0.516,0.9063829787234043,0.4925531914893617,0.2740425531914894
PFIZER.NS,5007.7,229090918400.0,203740086272.0,26.175,27.301823,5.9527529999999995,898300032.0,2.334,5446987264.0,5.385,0.091,0.35334998,0.2209,0.122,Is Pfizer Stock A Buy After It Clinches The $10 Billion Takeover Of Metsera?. Pfizer share price up 3% on rolling out this vaccine; key details inside. Pfizer India Shares rises 10% After a 85% Jump in Q4 Profit and ₹165 Dividend Announcement,0,-4548687232.0,0.8480000000000001,0.5161702127659574,0.5993617021276596,0.6948936170212766
PHOENIXLTD.NS,1743.8,623579955200.0,700039168000.0,29.862,58.010647,5.779454,49101713408.0,33.657,16740752384.0,0.769,0.215,0.27190000000000003,0.10095999400000001,0.278,Market volatility observed. Sector performance mixed.,0,32360961024.0,0.524,0.31382978723404253,0.16819148936170214,0.6668085106382979
PIDILITIND.NS,1467.4,1493393604608.0,1456469573632.0,46.213,67.188644,15.635922,4427700224.0,4.539,16949149696.0,2.149,0.099,0.16113001,0.24080999,0.326,Investor Optimism Abounds Pidilite Industries Limited (NSE:PIDILITIND) But Growth Is Lacking. Indian adhesives maker Pidilite's quarterly profit grows on strong demand. Pidilite Industries Ltd (NSE:PIDILITIND) Q2 2026 Earnings Report Preview: What To Look For,0,-12521449472.0,0.727,0.11404255319148934,0.492127659574468,0.5982978723404255
PPLPHARMA.NS,171.79,227692593152.0,267277271040.0,24.529,38.395044,2.814891,48509501440.0,60.083,4184262400.0,1.431,-0.088,-0.00266,-0.0029699998,0.129,InCred Equities sees 41% upside in Piramal Pharma; initiates 'Buy'. The Price Is Right For Piramal Pharma Limited (NSE:PPLPHARMA). SBI Cards to Piramal Pharma - Prashanth Tapse suggests 4 stocks to buy in the short term,0,44325239040.0,0.033,,,
POLYMED.NS,1880.8,190636933120.0,182935617536.0,40.337,52.713005,6.532597,2395548928.0,8.169,-1944842112.0,3.885,0.057,0.21142000000000002,0.13104999,0.026000000000000002,"What Poly Medicure Limited's (NSE:POLYMED) P/E Is Not Telling You. Medical device company share price zooms 47% in 1 month. Do you own?. Poly Medicure Gains on Global Acquisition, ESOP Allotment",0,4340391040.0,0.5700000000000001,0.2778723404255319,0.5172340425531915,0.5021276595744681
POLYCAB.NS,7218.5,1086644944896.0,1049786580992.0,29.167,44.34785,10.257018,2231190016.0,2.087,8382611456.0,1.941,0.178,0.10009000000000001,0.25748000000000004,0.446,Those who invested in Polycab India (NSE:POLYCAB) five years ago are up 627%. Polycab India - Kaynes Technology among 6 F&O stocks with a sharp rise in futures open Interest. What should investors do with Polycab shares after Q2 show? Analysts answer,0,-6151421440.0,0.635,0.3070212765957447,0.5114893617021277,0.6000000000000001
POONAWALLA.NS,449.25,362806149120.0,708365123584.0,24.664,158.74559,3.5539682,359791591424.0,364.414,1386025792.0,1049.45,0.613,0.105129994,0.024360001000000003,0.198,"Poonawalla Fincorp soars 11% on huge volumes, nears record high; here's why. Poonawalla Fincorp share price rises 6% despite sell-off in Indian stock market; here’s why. Poonawalla Fincorp - Valuation check: 9 stocks trading above Industry PE benchmarks",0,358405565632.0,0.246,0.333936170212766,0.315531914893617,0.5480851063829788
PFC.NS,342.55,1130725376000.0,11221325578240.0,24.664,4.565507,0.8902165,10064984276992.0,603.342,1386025792.0,36.447,0.12,0.49472000000000005,0.21113001,0.602,"Stocks to buy or sell: Dharmesh Shah of ICICI Sec suggests buying Indian Hotel, PFC shares today- 18 August 2025. Market Highlights: Sensex settles 95 pts lower, Nifty below 25,500; TechM, IndiGo drop 2% each. PFC, REC shares rally up to 6% on RBI relief for project financiers",0,10063598251200.0,0.868,0.8307446808510638,0.2936170212765958,0.7561702127659575
POWERGRID.NS,264.8,2462799888384.0,3766020997120.0,9.768,17.139158,2.4856613,1396777156608.0,141.186,-45036511232.0,0.889,0.018000000000000002,0.32917,0.15918000000000002,0.187,"Power Grid Share Price Live Updates: Power Grid experiences a slight dip in returns. Elara bets on NTPC, Power Grid; sees hydro sector on strong long-term path. Power Grid Share Price Live Updates: Power Grid's monthly returns indicate a downturn",0,1441813667840.0,0.731,0.8387234042553191,0.08404255319148936,0.5553191489361703
PRAJIND.NS,304.4,56051654656.0,53652123648.0,31.358,53.03136,4.296522,2097410944.0,16.118,-1623707136.0,1.419,0.031,0.03304,0.08116000000000001,0.193,"TCS, UBL, Praj Ind, Crompton Greaves from BSE500 index hit 52-week lows. Are Praj Industries Limited's (NSE:PRAJIND) Fundamentals Good Enough to Warrant Buying Given The Stock's Recent Weakness?. Q1 results impact: Praj Ind stock hits two-year low after PAT declines 94%; Awfis rises 7%, Titagarh Rail...",0,3721118080.0,0.14500000000000002,0.37191489361702135,0.3323404255319149,0.1646808510638298
PREMIERENE.NS,904.9,407056154624.0,382929600512.0,17.425,36.35597,11.735641,16221639680.0,46.964,-2726713856.0,1.7890000000000001,0.203,0.17081000000000002,0.41425,,"Is Premier Energies Limited's (NSE:PREMIERENE) Recent Stock Performance Tethered To Its Strong Fundamentals?. Waaree Energies, NTPC Green, Premier Energies: How renewable energy stocks are performing on June 18. Premier Energies, Waaree Energies shares climb over 6% as US imposes anti-dumping duties on 4 countries; check list",0,18948353536.0,0.8140000000000001,0.44659574468085106,0.27680851063829787,0.7472340425531916
PRESTIGE.NS,1652.2,711652474880.0,807001587712.0,31.765,94.51945,4.4963694,145103994880.0,89.294,-19814625280.0,1.207,0.055,0.09663000000000001,0.0505,0.16,"Stocks to Watch Today: Tata Steel, Ashoka Buildcon, Purvankara, Prestige Estates, Cipla, SBI Life.... Prestige Estate, ITC among top analyst bets; check target, stop-loss. Nifty Realty index slips 3%; DLF, Prestige, Godrej Properties down 4%",0,164918620160.0,0.254,0.27234042553191484,0.14882978723404255,0.29617021276595745
PGHH.NS,12562.0,407771774976.0,401097293824.0,30.727,56.97052,43.78697,20600000.0,0.221,1386025792.0,1.37,0.013000000000000001,0.21191000000000002,0.14603000000000002,0.177,"P&G Hygiene and Health Care shares fall 3% on weak earnings, Motilal Oswal says 'miss on all fronts'. P&G Hygiene Q1 results: Profit up two-fold to ₹192 cr, revenue at ₹937 cr. Procter & Gamble Hygiene and Health Care Limited's (NSE:PGHH) Business Is Trailing The Market But Its Shares Aren't",0,-1365425792.0,0.627,0.18361702127659574,0.475531914893617,0.48000000000000004
PNB.NS,117.57,1352063647744.0,961916764160.0,24.664,7.9225069999999995,0.94980735,1091620569088.0,20.567,1386025792.0,1.72,-0.056,0.32981000000000005,0.12666000000000002,0.463,"Indian Bank, PNB, Canara Bank and other PSU banks fall up to 12% from recent highs as sell-off intensifies. Indian Bank, PNB, other PSU bank stocks fall up to 6% after FinMin clarifies no proposal to hike FDI limit. Top stocks to buy today: Stock market recommendations for November 18, 2025 - check list",0,1090234543296.0,0.621,0.8137234042553192,0.3371276595744681,0.45744680851063835
RRKABEL.NS,1409.0,159342690304.0,163473932288.0,26.837,39.412586,6.810119,3926219008.0,16.78,-1809257856.0,1.847,0.195,0.048850004,0.18472000000000002,1.623,"Polycab India, KEI, Havells, RR Kabel, UltraTech tank up to 15%; here's why. India's R R Kabel maintains fiscal 2026 volume outlook as export shift pays off. Stocks to Watch Today: Coal India, Shanti Gold, Swiggy, PB Fintech, Chalet Hotels, RR Kabel, JSW Energy,...",0,5735476864.0,0.45199999999999996,0.4012765957446809,0.3881914893617021,0.4846808510638298
RECLTD.NS,344.0,906314973184.0,6184326135808.0,24.664,5.254315,1.0848312,5560553963520.0,666.088,1386025792.0,136.89,0.10400000000000001,0.7272900000000001,0.21997000000000003,0.302,"REC Ltd slips for fifth straight session. Earnings Working Against REC Limited's (NSE:RECLTD) Share Price. REC Ltd - Coal India, REC among top 10 largecap stocks with highest dividend yield in 1 year",0,5559167937728.0,0.889,0.8260638297872341,0.2980851063829787,0.7531914893617021
RHIM.NS,439.9,90932690944.0,94437924864.0,22.403,57.88158,2.2681103,4146775040.0,10.315,360279136.0,2.615,0.194,0.04009,0.039670000000000004,0.14,"RHI Magnesita India - Positive Breakout: These 11 stocks close cross above their 200 DMAs. Top stocks to buy today: Stock recommendations for July 23, 2025 - check list. RHI Magnesita India's (NSE:RHIM) Solid Profits Have Weak Fundamentals",0,3786495904.0,0.11699999999999999,0.4953191489361702,0.4757446808510638,0.3336170212765958
RITES.NS,225.89,108567994368.0,99880189952.0,18.488,26.389017,4.1285596,78400000.0,0.28500000000000003,3397362432.0,1.587,0.015,0.18438000000000002,0.16570999,0.065,"After remaining under pressure for five months, can multibagger Rites make a comeback?. RITES share rises 3% on securing deal worth ₹373 cr from NIMHANS Bengaluru. Rites - Positive Breakout: These 10 stocks cross above their 200 DMAs",0,-3318962432.0,0.6659999999999999,0.6553191489361702,0.49691489361702135,0.4872340425531915
RADICO.NS,3199.7,428507103232.0,438224584704.0,53.911,93.39463,14.37809,6235012096.0,20.939,3245449728.0,1.654,0.338,0.081750005,0.16516,0.424,"Radico Khaitan surges 6%, hits record high; analysts see more upside. Top Gainers & Losers on Nov 20: Jaiprakash Power, Radico Khaitan, Eicher Motors, TBO Tek among top gainers. Radico Khaitan - 10 Diwali 2025 stock picks from Motilal Oswal that could rally up to 38%",0,2989562368.0,0.487,0.07,0.3114893617021277,0.6021276595744681
RVNL.NS,311.9,651754602496.0,677625069568.0,71.132,57.334557,6.831672,49806901248.0,52.108,-36523151360.0,2.115,0.055,0.056700002000000006,0.12377,1.111,"BSE, RVNL to Adani Power: These 10 stocks are fastest wealth creators in last 5 years, shows MOSL study. Stocks to Watch today, Aug 28: IndiGo, Power Grid, Oil India, BPCL, RVNL. RVNL Share Price: PSU stock gains despite selloff in stock market - Here's why",0,86330052608.0,0.283,0.20957446808510638,0.30106382978723406,0.26595744680851063
RAILTEL.NS,332.25,106684653568.0,99852828672.0,18.038,33.291584,5.0480113,705900032.0,3.341,-466087488.0,1.3719999999999999,0.128,0.085030004,0.16031,0.5,Railtel Corporation of India Forms Death Cross Signalling Potential Bearish Trend. RailTel Corporation wins project from Ministry Of External Affairs; shares trade flat. Railtel Corporation Of India - Negative Breakout: These 12 stocks cross below their 200 DMAs,0,1171987520.0,0.48,0.5840425531914893,0.4143617021276596,0.4791489361702128
RAINBOW.NS,1379.7,140162170880.0,141284425728.0,31.457,55.588234,9.230306,8161260032.0,53.24,583912512.0,3.492,0.065,0.16206,0.17687000000000003,0.191,Systematix bets on Rainbow Medicare's pan-India leap; sees 27% upside. Stocks to buy in 2025 for long term: Inox Wind over 5 stocks that could give 20-25% in long run. Your next big bet: This beaten-down hospital stock could be set for another rally | Stock Market News,0,7577347520.0,0.658,0.2543617021276596,0.35,0.5319148936170213
RKFORGE.NS,519.4,93985603584.0,120373223424.0,25.342,42.090763,3.0338962,27218507776.0,88.73,-9078409216.0,1.056,-0.139,0.056539997,0.07421000000000001,0.14100000000000001,"Ramkrishna Forgings plunges 12%, at 52-wk low on heavy volumes; here's why. Ramkrishna Forgings share price tumbles 12% to fresh 52-week low. What's behind the fall in this BSE 500 stock?. Ramkrishna Forgings, Iris Clothings, Mastek, Muthoot Fin: Stocks that are seeing a spurt in volumes today",0,36296916992.0,0.178,0.48574468085106387,0.12861702127659574,0.10936170212765957
RCF.NS,138.51,76414320640.0,93624500224.0,12.494,24.42857,1.5522109,27780599808.0,56.443,-8573887488.0,1.241,0.234,0.018480001000000003,0.06548000000000001,0.291,"Stocks to buy or sell: Osho Krishan of Angel One suggests buying RCF, MCX shares today - 18 September. Rallis, RCF, Deepak Fertilisers rally up to 9%; what's driving agri stocks?. FACT, RCF, Agro Phos shares rise up to 5% as China may lift curbs on fertiliser exports",0,36354487296.0,0.097,,,
REDINGTON.NS,279.95,218857750528.0,231904542720.0,10.161,12.655968,2.4289198,26086699008.0,27.764,-15601149952.0,1.415,0.168,0.01597,0.22066000000000002,0.808,Why did Redington share hit all-time high on May 20? Check reasons here. Apple supplier Redington's shares surge 11% after stellar Q2 results: How to trade?. Redington shares hit 20% UC ahead of iPhone 17 sale in India; heavy volumes aid sentiment,0,41687848960.0,0.43100000000000005,0.8602127659574468,0.2621276595744681,0.43106382978723407
RELIANCE.NS,1545.0,20908439764992.0,24044810272768.0,14.026,25.130123,2.3838179999999998,3745930018816.0,35.651,251736244224.0,1.1,0.1,0.08314,0.09717,0.309,Reliance leads India's stock benchmarks towards record high levels. Reliance Industries share price hits 4-month high as analysts see earnings boost from O2C and new energy business. 10 stocks in Morgan Stanley's focus portfolio as it bets on a revival in Indian equities in 2026,0,3494193774592.0,0.277,0.765531914893617,0.19425531914893618,0.3493617021276596
RELINFRA.NS,129.29,52773740544.0,57094892748.8,24.664,1.8425251999999999,0.30847818,2729737587.2,20.567,54502674432.0,0.268,0.096,0.14376001,0.35316002,1.165,"Reliance Infra share price gains despite Indian stock market crash. Here’s why. Reliance Infra, Reliance Power tank up to 54% from June highs; here's why. Reliance Power, Reliance Infra shares tumble 5% amid ED Probe into Rs 17,000 crore loan fraud",0,-51772936844.8,0.7669999999999999,0.8401063829787233,0.20340425531914894,0.6008510638297873
RPOWER.NS,33.54,138745036800.0,275663749120.0,10.005,56.84746,0.8404119600000001,152315101184.0,92.224,-1965312512.0,0.488,0.122,0.038950000000000005,0.01938,1.045,"Reliance Power shares down 15% in a month as ED probe drags. Can the stock reclaim Rs 70 amid volatility?. From Adani Enterprises, NBCC to Reliance Power – Here are 8 stocks to watch. Man Industries Partners with Aramco Asia | Reliance Power Focuses on Governance Improvements | Top Buzzing Stocks Today",0,154280413696.0,0.10099999999999999,0.6568085106382979,0.08787234042553192,0.2663829787234043
SBFC.NS,105.07,115131809792.0,171600592896.0,24.664,29.431374,3.3389474999999997,61756518400.0,179.825,1386025792.0,391.324,0.28600000000000003,0.42638000000000004,0.12254000000000001,0.663,"Stocks to Watch Today: Tata Motors, Bank of Baroda, SBFC Finance, Mahindra Holidays, Eicher, Titagarh.... SBFC Finance - FIIs, promoters reduce holdings in 11 smallcaps; prices rise up to 87% in FY26. Volumes jump at SBFC Finance Ltd counter",0,60370492608.0,0.636,0.589468085106383,0.35000000000000003,0.7702127659574469
SBICARD.NS,873.2,830891294720.0,1282337800192.0,24.664,43.31349,5.618216,492245090304.0,332.839,1386025792.0,21.127,0.201,0.17877,0.13762000000000002,0.341,"SBI Cards And Payment Services - Negative Breakout: These 12 stocks cross below their 200 DMAs. SBI Cards shares drop 6% as profit takes a hit in Q1; what should you do?. Stocks to buy for short term: AIA Engineering, SBI Card, APL Apollo among 6 shares experts recommend for next 2-3 weeks",0,490859064512.0,0.556,0.4301063829787234,0.3021276595744681,0.6391489361702127
SBILIFE.NS,2006.9,2012884369408.0,2003658342400.0,72.372,82.317474,11.004189,0.0,20.567,32364961792.0,1.168,-0.428,0.023590000000000003,0.14199,0.356,"SBI Life Share Price Live Updates: SBI Life's Recent Returns. Stocks to Watch Today: Tata Steel, Ashoka Buildcon, Purvankara, Prestige Estates, Cipla, SBI Life.... Stocks to buy: Rajesh Palviya of Axis Sec suggests Natco Pharma, Eicher Motors, SBI Life shares today",0,-32364961792.0,0.271,0.0948936170212766,0.25957446808510637,0.1025531914893617
SJVN.NS,72.08,283259633664.0,556720193536.0,25.816,49.710346,1.9506915,295670185984.0,202.556,-49263538176.0,0.646,0.006,0.17826,0.038090000000000006,0.323,"SJVN - Vodafone Idea among 7 midcap stocks with high EV to Market cap ratios. SJVN shares down 5% as company slips into loss in Q4; Key details here. Stocks to buy for short term: Nagaraj Shetti suggests SJVN, Berger Paints shares; do you own?",0,344933724160.0,0.379,0.4970212765957447,0.060851063829787236,0.35404255319148936
SRF.NS,2943.7,872585756672.0,908426149888.0,27.907,53.983128,6.576484,46049701888.0,34.719,7906449920.0,1.111,0.063,0.10597999400000001,0.12807000000000002,0.097,"5 stocks to avoid in current market; SRF, Devyani, 3 more may dip up to 15%. Abbott India, SRF and 3 other stocks showing bullish RSI upswing. Stocks to buy: Rajesh Palviya of Axis Sec suggests Ceat, SRF, Godrej Properties shares today",0,38143251968.0,0.41100000000000003,0.3272340425531915,0.19893617021276594,0.3804255319148936
SAGILITY.NS,49.72,232755658752.0,235242127360.0,17.295,29.076023,2.6455252,12319529984.0,13.850999999999999,7687406080.0,1.841,0.252,0.12845999,0.09561000000000001,,"Motilal Oswal initiates IKS, Sagility with 'Buy'; Indegene 'Neutral'. Sagility surges nearly 6% after 2.2 crore shares change hands in block deal. Promoter offloads 16.4% stake in Sagility, 5 global & domestic institutional investors pick 8.6%...",0,4632123904.0,0.366,0.6874468085106382,0.40170212765957447,0.563404255319149
SAILIFE.NS,903.7,190086135808.0,186991280128.0,37.548,64.96765,8.35452,4175610112.0,18.397,-3117329920.0,1.921,0.359,0.13949999,0.17278999,,Market volatility observed. Sector performance mixed.,0,7292940032.0,0.611,0.20723404255319147,0.3893617021276596,0.7076595744680851
